Date,User,Tweet,text,tokenize_text,polarity,sentiment
2014-05-02 16:04:44+00:00,narendramodi,"Tomorrow I will address more 3D rallies across AP, Bihar, HP, UP, Uttarakhand &amp; West Bengal http://t.co/kkDu5U7Jhi",tomorrow i will address more 3d rallies across ap bihar hp up uttarakhand amp west bengal,tomorrow address 3d rally across ap bihar hp uttarakhand amp west bengal,0.0,Neutral
2014-05-02 16:02:09+00:00,narendramodi,India is one. NDA will not work for Hindus or Muslims but for realising the dreams of the people of India http://t.co/Yk1HaO2ngt,india is one nda will not work for hindus or muslims but for realising the dreams of the people of india,india one nda work hindu muslim realising dream people india,0.0,Positive
2014-05-02 16:01:11+00:00,narendramodi,"PM may have spoken even 1,100 times but did he ever talk about how Sonia ji's NAC,not Planning Commission mattered more in decision making?",pm may have spoken even 1100 times but did he ever talk about how sonia jis nacnot planning commission mattered more in decision making,pm may spoken even 1100 time ever talk sonia ji nacnot planning commission mattered decision making,0.0,Negative 
2014-05-02 16:00:42+00:00,narendramodi,Cong is only bothered about power &amp; the chair. A Mother's love is understandable but not at the cost of the nation &amp; people's aspirations.,cong is only bothered about power amp the chair a mothers love is understandable but not at the cost of the nation amp peoples aspirations,cong bothered power amp chair mother love understandable cost nation amp people aspiration,0.5,Negative 
2014-05-02 16:00:24+00:00,narendramodi,If Cong thinks they can survive by repeating false promises they are mistaken. People of India have called Cong's bluff &amp; will punish it.,if cong thinks they can survive by repeating false promises they are mistaken people of india have called congs bluff amp will punish it,cong think survive repeating false promise mistaken people india called congs bluff amp punish,-0.4000000000000001,Negative 
2014-05-02 16:00:03+00:00,narendramodi,While I was speaking I could see large number of people gathered at the various locations. I derive lot of strength from their enthusiasm.,while i was speaking i could see large number of people gathered at the various locations i derive lot of strength from their enthusiasm,speaking could see large number people gathered various location derive lot strength enthusiasm,0.1071428571428571,Positive
2014-05-02 15:59:26+00:00,narendramodi,Addressed 3D rallies in over 100 places across India. After this round I have addressed 900 3D rallies in the last few weeks.,addressed 3d rallies in over 100 places across india after this round i have addressed 900 3d rallies in the last few weeks,addressed 3d rally 100 place across india round addressed 900 3d rally last week,-0.1,Positive
2014-05-02 12:34:59+00:00,narendramodi,Hope to see you at the 3D rallies later this evening. Here are the locations once again http://t.co/kkDu5U7Jhi,hope to see you at the 3d rallies later this evening here are the locations once again,hope see 3d rally later evening location,0.0,Positive
2014-05-02 12:22:08+00:00,narendramodi,"दिल्ली में दोस्ती, लखनऊ में कुश्ती- यही एसपी, बीएसपी, कांग्रेस का मंत्र है।  यह तीनों एक हैं।  इनसे विकास नहीं होगा http://t.co/DcsSXM0JHX",dalit me dast lucknow me kisht ye asp bicep krish ki mitra this body is the same inis work,dalit dast lucknow kisht ye asp bicep krish ki mitra body inis work,0.0,Negative 
2014-05-02 12:20:50+00:00,narendramodi,"Congress, SP &amp; BSP are fighting for the chair while we are fighting for your happiness. Divide &amp; rule is their way, unite &amp; progress is ours",congress sp amp bsp are fighting for the chair while we are fighting for your happiness divide amp rule is their way unite amp progress is ours,congress sp amp bsp fighting chair fighting happiness divide amp rule way unite amp progress,0.7,Negative 
2014-05-02 12:19:33+00:00,narendramodi,"Congress' appetite for corruption is legendary! From the earth, seas till the skies they spared nothing! UP will not accept this any longer.",congress appetite for corruption is legendary from the earth seas till the skies they spared nothing up will not accept this any longer,congress appetite corruption legendary earth sea till sky spared nothing accept longer,1.0,Negative 
2014-05-02 12:18:31+00:00,narendramodi,"Joined Bharat Vijay Rallies in Khalilabad, Basti, Gonda &amp; Balrampur. Despite the scorching heat the rallies witnessed record attendance!",joined bharat vijay rallies in khalilabad basti gonda amp balrampur despite the scorching heat the rallies witnessed record attendance,joined bharat vijay rally khalilabad basti gonda amp balrampur despite scorching heat rally witnessed record attendance,0.0,Positive
2014-05-02 03:36:09+00:00,narendramodi,Over the next 3 days I will address 3 rounds of 3D rallies. Here are the locations for the rallies today http://t.co/kkDu5U7Jhi,over the next 3 days i will address 3 rounds of 3d rallies here are the locations for the rallies today,next 3 day address 3 round 3d rally location rally today,-0.1,Positive
2014-05-01 15:06:00+00:00,narendramodi,My heartfelt greetings on the auspicious occasion of Parshuram Jayanti. May Lord Parshuram bless us with courage &amp; knowledge.,my heartfelt greetings on the auspicious occasion of parshuram jayanti may lord parshuram bless us with courage amp knowledge,heartfelt greeting auspicious occasion parshuram jayanti may lord parshuram bless u courage amp knowledge,0.0,Positive
2014-05-01 14:02:46+00:00,narendramodi,"2014 polls are a choice between those who want a Scam India &amp; NDA, which is working hard to create a Skilled India http://t.co/VNRefIGPgv",2014 polls are a choice between those who want a scam india amp nda which is working hard to create a skilled india,2014 poll choice want scam india amp nda working hard create skilled india,0.1041666666666666,Positive
2014-05-01 14:01:48+00:00,narendramodi,People were very happy to know about our endeavour to build smart cities across India &amp; our commitment to make Seemandhra a ‘Knowledge Hub.’,people were very happy to know about our endeavour to build smart cities across india amp our commitment to make seemandhra a knowledge hub,people happy know endeavour build smart city across india amp commitment make seemandhra knowledge hub,0.5071428571428571,Positive
2014-05-01 14:00:46+00:00,narendramodi,Youngsters from AP working in Gulf are exploited but UPA is not bothered. NDA will take all steps to protect interests of our youngsters.,youngsters from ap working in gulf are exploited but upa is not bothered nda will take all steps to protect interests of our youngsters,youngster ap working gulf exploited upa bothered nda take step protect interest youngster,0.0,Positive
2014-05-01 13:59:58+00:00,narendramodi,"Had UPA integrated rivers, Seemandhra's farmers would not have suffered. We will fulfil Atal ji's dream of river linking &amp; help farmers.",had upa integrated rivers seemandhras farmers would not have suffered we will fulfil atal jis dream of river linking amp help farmers,upa integrated river seemandhras farmer would suffered fulfil atal ji dream river linking amp help farmer,0.0,Positive
